{
  "$schema": "https://json-schema.org/draft/2020-12/schema",
  "$id": "https://lapp.dev/schema/1.0/provider.schema.json",
  "title": "LAPP v1 provider.json",
  "type": "object",
  "required": ["schemaVersion", "id", "baseUrl", "protocols", "auth"],
  "additionalProperties": false,
  "properties": {
    "schemaVersion": { "const": "1.0" },
    "id": {
      "type": "string",
      "pattern": "^[a-z0-9][a-z0-9._-]{0,63}$"
    },
    "name": { "type": "string", "minLength": 1 },
    "enabled": { "type": "boolean" },
    "baseUrl": { "type": "string", "minLength": 1 },
    "protocols": {
      "type": "array",
      "minItems": 1,
      "uniqueItems": true,
      "items": { "$ref": "#/$defs/protocolId" }
    },
    "auth": { "$ref": "#/$defs/auth" },
    "requestHeaders": { "$ref": "#/$defs/headers" },
    "modelDiscovery": {
      "type": "object",
      "required": ["protocol", "url"],
      "additionalProperties": false,
      "properties": {
        "protocol": { "enum": ["openai-models", "anthropic-models"] },
        "url": { "type": "string", "minLength": 1 }
      }
    },
    "extensions": {
      "type": "object",
      "additionalProperties": true
    }
  },
  "$defs": {
    "protocolId": {
      "type": "string",
      "pattern": "^[A-Za-z0-9][A-Za-z0-9._-]{0,127}$"
    },
    "secret": {
      "type": "string",
      "pattern": "^(?!\\s*$)[^\\r\\n]+$"
    },
    "auth": {
      "oneOf": [
        {
          "type": "object",
          "required": ["type"],
          "additionalProperties": false,
          "properties": { "type": { "const": "none" } }
        },
        {
          "type": "object",
          "required": ["type", "secret"],
          "additionalProperties": false,
          "properties": {
            "type": { "const": "bearer" },
            "secret": { "$ref": "#/$defs/secret" }
          }
        },
        {
          "type": "object",
          "required": ["type", "name", "secret"],
          "additionalProperties": false,
          "properties": {
            "type": { "const": "header" },
            "name": { "$ref": "#/$defs/headerName" },
            "secret": { "$ref": "#/$defs/secret" }
          }
        },
        {
          "type": "object",
          "required": ["type", "name", "secret"],
          "additionalProperties": false,
          "properties": {
            "type": { "const": "query" },
            "name": { "type": "string", "minLength": 1 },
            "secret": { "$ref": "#/$defs/secret" }
          }
        }
      ]
    },
    "headerName": {
      "type": "string",
      "pattern": "^[!#$%&'*+.^_`|~0-9A-Za-z-]+$"
    },
    "headers": {
      "type": "object",
      "propertyNames": { "$ref": "#/$defs/headerName" },
      "additionalProperties": {
        "type": "string",
        "pattern": "^[^\\r\\n]*$"
      }
    }
  }
}
